{
  "$schema": "./schema.json",
  "contractVersion": "1",
  "installationInputs": [
    {"logicalName":"platformPublicOrigin","type":"origin","required":true,"owner":"platform-contract","consumer":"Workspace Manager 與部署 Adapter","secret":false,"derived":false,"disposition":"keep-input","mapping":{"composeInput":"PLATFORM_PUBLIC_ORIGIN","helmValuesPath":"platformPublicOrigin"}},
    {"logicalName":"oidcIssuerUrl","type":"url","required":true,"owner":"platform-contract","consumer":"Workspace Manager OIDC client","secret":false,"derived":false,"disposition":"keep-input","mapping":{"composeInput":"OIDC_ISSUER_URL","helmValuesPath":"oidc.issuerUrl"}},
    {"logicalName":"oidcClientId","type":"string","required":true,"owner":"platform-contract","consumer":"Workspace Manager OIDC client","secret":false,"derived":false,"disposition":"keep-input","mapping":{"composeInput":"OIDC_CLIENT_ID","helmValuesPath":"oidc.clientId"}},
    {"logicalName":"timezone","type":"string","required":true,"owner":"compose-adapter","consumer":"Compose containers and local third-party images","secret":false,"derived":false,"disposition":"keep-input","mapping":{"composeInput":"TZ"}},
    {"logicalName":"installationId","type":"string","required":true,"owner":"platform-contract","consumer":"Manager and connectivity evidence services","secret":false,"derived":false,"disposition":"keep-input","mapping":{"composeInput":"AILERON_INSTALLATION_ID","helmValuesPath":"connectivityEvidenceGateway.installationId"}},
    {"logicalName":"bootstrapAdminSubject","type":"uuid","required":true,"owner":"platform-contract","consumer":"Identity bootstrap and local OIDC fixture","secret":false,"derived":false,"disposition":"keep-input","mapping":{"composeInput":"BOOTSTRAP_ADMIN_SUBJECT","helmValuesPath":"bootstrap.admin.subject"}},
    {"logicalName":"bootstrapAdminUsername","type":"string","required":true,"owner":"platform-contract","consumer":"Identity bootstrap and local OIDC fixture","secret":false,"derived":false,"disposition":"keep-input","mapping":{"composeInput":"BOOTSTRAP_ADMIN_USERNAME","helmValuesPath":"bootstrap.admin.username"}},
    {"logicalName":"bootstrapAdminEmail","type":"email","required":true,"owner":"platform-contract","consumer":"Identity bootstrap and local OIDC fixture","secret":false,"derived":false,"disposition":"keep-input","mapping":{"composeInput":"BOOTSTRAP_ADMIN_EMAIL","helmValuesPath":"bootstrap.admin.email"}},
    {"logicalName":"hostProjectRoot","type":"path","required":true,"owner":"compose-adapter","consumer":"Compose bind mount sources and Docker provisioner host paths","secret":false,"derived":false,"disposition":"keep-input","mapping":{"composeInput":"HOST_PROJECT_ROOT"}},
    {"logicalName":"hostPlatformSecretsDirectory","type":"path","required":true,"owner":"external-secret-owner","consumer":"Compose secret file sources","secret":false,"derived":false,"disposition":"keep-input","mapping":{"composeInput":"HOST_PLATFORM_SECRETS_DIR"}},
    {"logicalName":"hostTurnConfigDirectory","type":"path","required":true,"owner":"compose-adapter","consumer":"TURN reachability profile bind source","secret":false,"derived":false,"disposition":"keep-input","mapping":{"composeInput":"HOST_TURN_CONFIG_DIR"}},
    {"logicalName":"hostTurnSecretsDirectory","type":"path","required":true,"owner":"external-secret-owner","consumer":"Compose TURN secret file sources","secret":false,"derived":false,"disposition":"keep-input","mapping":{"composeInput":"HOST_TURN_SECRETS_DIR"}},
    {"logicalName":"turnCredentialRevision","type":"string","required":true,"owner":"platform-contract","consumer":"TURN readiness and connectivity evidence","secret":false,"derived":false,"disposition":"keep-input","mapping":{"composeInput":"TURN_CREDENTIAL_REVISION","helmValuesPath":"turn.credentialRevision"}},
    {"logicalName":"turnConnectivityGatewayExternalPort","type":"port","required":true,"owner":"compose-adapter","consumer":"Host-network connectivity agent and Compose port publishing","secret":false,"derived":false,"disposition":"keep-input","mapping":{"composeInput":"TURN_CONNECTIVITY_GATEWAY_EXTERNAL_PORT"}},
    {"logicalName":"turnRelayMinPort","type":"port","required":true,"owner":"compose-adapter","consumer":"Coturn relay range and readiness validation","secret":false,"derived":false,"disposition":"keep-input","mapping":{"composeInput":"TURN_RELAY_MIN_PORT"}},
    {"logicalName":"turnRelayMaxPort","type":"port","required":true,"owner":"compose-adapter","consumer":"Coturn relay range and readiness validation","secret":false,"derived":false,"disposition":"keep-input","mapping":{"composeInput":"TURN_RELAY_MAX_PORT"}},
    {"logicalName":"browserExtensionId","type":"string","required":false,"owner":"frontend-build","consumer":"Frontend browser extension capability","secret":false,"derived":false,"disposition":"keep-input","mapping":{"composeInput":"VITE_BROWSER_EXTENSION_ID"}},
    {"logicalName":"workspaceManagerImage","type":"image","required":true,"owner":"compose-adapter","consumer":"Compose Manager and init services","secret":false,"derived":false,"disposition":"keep-input","mapping":{"composeInput":"WORKSPACE_MANAGER_IMAGE"}},
    {"logicalName":"workspaceOperatorImage","type":"image","required":true,"owner":"compose-adapter","consumer":"Compose connectivity services and Browser probe","secret":false,"derived":false,"disposition":"keep-input","mapping":{"composeInput":"WORKSPACE_OPERATOR_IMAGE"}},
    {"logicalName":"workspaceRuntimeImage","type":"image","required":true,"owner":"compose-adapter","consumer":"Workspace Manager Docker provisioner","secret":false,"derived":false,"disposition":"keep-input","mapping":{"composeInput":"WORKSPACE_RUNTIME_IMAGE"}},
    {"logicalName":"workspaceUiImage","type":"image","required":true,"owner":"compose-adapter","consumer":"Compose Frontend service","secret":false,"derived":false,"disposition":"keep-input","mapping":{"composeInput":"WORKSPACE_UI_IMAGE"}},
    {"logicalName":"coturnImage","type":"image","required":true,"owner":"compose-adapter","consumer":"Compose Coturn and readiness validation","secret":false,"derived":false,"disposition":"keep-input","mapping":{"composeInput":"COTURN_IMAGE"}}
  ],
  "helmSecretReferences": [
    {"logicalName":"platformDatabaseUrl","required":true,"owner":"external-secret-owner","consumer":"Workspace Manager and bootstrap database connection","secret":true,"derived":false,"disposition":"replace-with-secret-reference","mapping":{"secretNameValuesPath":"platformSecrets.existingSecretName","secretKeyValuesPath":"platformSecrets.databaseUrlKey"}},
    {"logicalName":"runtimeDatabaseCredential","required":true,"owner":"external-secret-owner","consumer":"Workspace Runtime database credential","secret":true,"derived":false,"disposition":"replace-with-secret-reference","mapping":{"secretNameValuesPath":"platformSecrets.existingSecretName","secretKeyValuesPath":"platformSecrets.runtimeDatabaseCredentialKey"}},
    {"logicalName":"postgresUsername","required":true,"owner":"external-secret-owner","consumer":"Postgres role bootstrap","secret":true,"derived":false,"disposition":"replace-with-secret-reference","mapping":{"secretNameValuesPath":"platformSecrets.existingSecretName","secretKeyValuesPath":"platformSecrets.postgresUsernameKey"}},
    {"logicalName":"postgresPassword","required":true,"owner":"external-secret-owner","consumer":"Postgres role bootstrap","secret":true,"derived":false,"disposition":"replace-with-secret-reference","mapping":{"secretNameValuesPath":"platformSecrets.existingSecretName","secretKeyValuesPath":"platformSecrets.postgresPasswordKey"}},
    {"logicalName":"runtimeAssertionPrivateKey","required":true,"owner":"external-secret-owner","consumer":"Workspace Manager runtime assertion signer","secret":true,"derived":false,"disposition":"replace-with-secret-reference","mapping":{"secretNameValuesPath":"runtimeAssertions.privateKeySecretName","secretKeyValuesPath":"runtimeAssertions.privateKeySecretKey"}},
    {"logicalName":"runtimeAssertionPublicJwks","required":true,"owner":"external-secret-owner","consumer":"Workspace Runtime assertion verifier","secret":true,"derived":false,"disposition":"replace-with-secret-reference","mapping":{"secretNameValuesPath":"runtimeAssertions.publicKeySetSecretName","secretKeyValuesPath":"runtimeAssertions.publicKeySetSecretKey"}},
    {"logicalName":"browserCredentialKeyring","required":true,"owner":"external-secret-owner","consumer":"Workspace browser credential projection","secret":true,"derived":false,"disposition":"replace-with-secret-reference","mapping":{"secretNameValuesPath":"browserCredentials.existingSecretName","secretKeyValuesPath":"browserCredentials.key"}},
    {"logicalName":"oidcClientSecret","required":true,"owner":"external-secret-owner","consumer":"Workspace Manager OIDC client","secret":true,"derived":false,"disposition":"replace-with-secret-reference","mapping":{"secretNameValuesPath":"oidc.clientSecretName","secretKeyValuesPath":"oidc.clientSecretKey"}},
    {"logicalName":"oidcCaCertificate","required":false,"owner":"external-secret-owner","consumer":"Workspace Manager OIDC TLS trust","secret":true,"derived":false,"disposition":"replace-with-secret-reference","mapping":{"secretNameValuesPath":"oidc.caSecretName","secretKeyValuesPath":"oidc.caSecretKey"}},
    {"logicalName":"turnBackendIceServers","required":false,"owner":"external-secret-owner","consumer":"Workspace Runtime TURN backend policy","secret":true,"derived":false,"disposition":"replace-with-secret-reference","mapping":{"secretNameValuesPath":"turn.existingSecretName","secretKeyValuesPath":"turn.backendIceServersKey"}},
    {"logicalName":"turnFrontendIceServers","required":false,"owner":"external-secret-owner","consumer":"Workspace Browser TURN frontend policy","secret":true,"derived":false,"disposition":"replace-with-secret-reference","mapping":{"secretNameValuesPath":"turn.existingSecretName","secretKeyValuesPath":"turn.frontendIceServersKey"}},